{
  "advisoryId": "ISA_ADVISORY_v1.0",
  "version": "1.0.0",
  "publicationDate": "2025-12-13",
  "datasetRegistryVersion": "1.0.0",
  "author": "ISA Execution Agent",
  "regulationsCovered": [
    {
      "id": "csrd_esrs",
      "name": "Corporate Sustainability Reporting Directive (CSRD) / ESRS",
      "legalStatus": "binding",
      "effectiveDate": "2024-01-01",
      "datasetIds": [
        "esrs.datapoints.ig3",
        "gs1nl.benelux.diy_garden_pet.v3.1.33",
        "gs1nl.benelux.fmcg.v3.1.33.5",
        "gs1nl.benelux.healthcare.v3.1.33"
      ]
    },
    {
      "id": "eudr",
      "name": "EU Deforestation Regulation (EUDR)",
      "legalStatus": "binding",
      "effectiveDate": "2025-12-30",
      "datasetIds": [
        "gs1.ctes_kdes",
        "gdsn.current.v3.1.32"
      ]
    },
    {
      "id": "dpp",
      "name": "Digital Product Passport (DPP) Framework",
      "legalStatus": "binding",
      "effectiveDate": "2027-02-18",
      "datasetIds": [
        "eu.dpp.identification_rules",
        "gs1.cbv_digital_link"
      ]
    }
  ],
  "sectorModelsCovered": [
    {
      "id": "gs1nl.benelux.diy_garden_pet.v3.1.33",
      "name": "GS1 NL DIY/Garden/Pets",
      "version": "3.1.33",
      "totalAttributes": 3009
    },
    {
      "id": "gs1nl.benelux.fmcg.v3.1.33.5",
      "name": "GS1 NL FMCG",
      "version": "3.1.33.5",
      "totalAttributes": 473
    },
    {
      "id": "gs1nl.benelux.healthcare.v3.1.33",
      "name": "GS1 NL Healthcare",
      "version": "3.1.33",
      "totalAttributes": 185
    }
  ],
  "mappingResults": [
    {
      "mappingId": "MAP-DPP-001",
      "regulationDatapoint": "Unique product identifier",
      "disclosureRequirement": "DPP-Core",
      "regulationStandard": "DPP",
      "gs1Attribute": "GTIN",
      "gs1AttributeCode": "GTIN",
      "sectors": [
        "All"
      ],
      "confidence": "direct",
      "confidenceScore": null,
      "rationale": "GTIN is the standard product identifier for DPP",
      "datasetReferences": [
        "eu.dpp.identification_rules",
        "gs1.cbv_digital_link"
      ]
    },
    {
      "mappingId": "MAP-DPP-002",
      "regulationDatapoint": "Product name",
      "disclosureRequirement": "DPP-Core",
      "regulationStandard": "DPP",
      "gs1Attribute": "Product Description",
      "gs1AttributeCode": "PRODUCT_DESCRIPTION",
      "sectors": [
        "All"
      ],
      "confidence": "direct",
      "confidenceScore": null,
      "rationale": "Product Description provides direct coverage for DPP product name requirement",
      "datasetReferences": [
        "eu.dpp.identification_rules",
        "gs1nl.benelux.diy_garden_pet.v3.1.33",
        "gs1nl.benelux.fmcg.v3.1.33.5",
        "gs1nl.benelux.healthcare.v3.1.33"
      ]
    },
    {
      "mappingId": "MAP-DPP-003",
      "regulationDatapoint": "Manufacturer identification",
      "disclosureRequirement": "DPP-Core",
      "regulationStandard": "DPP",
      "gs1Attribute": "Brand Owner GLN",
      "gs1AttributeCode": "BRAND_OWNER_GLN",
      "sectors": [
        "All"
      ],
      "confidence": "direct",
      "confidenceScore": null,
      "rationale": "Brand Owner GLN provides direct manufacturer identification",
      "datasetReferences": [
        "eu.dpp.identification_rules",
        "gdsn.current.v3.1.32"
      ]
    },
    {
      "mappingId": "MAP-DPP-004",
      "regulationDatapoint": "Material composition",
      "disclosureRequirement": "DPP-Extended",
      "regulationStandard": "DPP",
      "gs1Attribute": "Material Type",
      "gs1AttributeCode": "MATERIAL_TYPE",
      "sectors": [
        "DIY",
        "FMCG"
      ],
      "confidence": "direct",
      "confidenceScore": null,
      "rationale": "Material Type attributes provide direct coverage for DPP material composition",
      "datasetReferences": [
        "eu.dpp.identification_rules",
        "gs1nl.benelux.diy_garden_pet.v3.1.33",
        "gs1nl.benelux.fmcg.v3.1.33.5"
      ]
    },
    {
      "mappingId": "MAP-DPP-005",
      "regulationDatapoint": "Repair instructions",
      "disclosureRequirement": "DPP-Extended",
      "regulationStandard": "DPP",
      "gs1Attribute": null,
      "gs1AttributeCode": null,
      "sectors": [
        "DIY"
      ],
      "confidence": "missing",
      "confidenceScore": 0,
      "rationale": "No GS1 NL attribute for repair instructions URL",
      "datasetReferences": [
        "eu.dpp.identification_rules",
        "gs1nl.benelux.diy_garden_pet.v3.1.33"
      ]
    },
    {
      "mappingId": "MAP-DPP-006",
      "regulationDatapoint": "Spare parts availability",
      "disclosureRequirement": "DPP-Extended",
      "regulationStandard": "DPP",
      "gs1Attribute": null,
      "gs1AttributeCode": null,
      "sectors": [
        "DIY"
      ],
      "confidence": "missing",
      "confidenceScore": 0,
      "rationale": "No GS1 NL attribute for spare parts availability indicator",
      "datasetReferences": [
        "eu.dpp.identification_rules",
        "gs1nl.benelux.diy_garden_pet.v3.1.33"
      ]
    },
    {
      "mappingId": "MAP-DPP-007",
      "regulationDatapoint": "Disassembly instructions",
      "disclosureRequirement": "DPP-Extended",
      "regulationStandard": "DPP",
      "gs1Attribute": null,
      "gs1AttributeCode": null,
      "sectors": [
        "DIY",
        "Healthcare"
      ],
      "confidence": "missing",
      "confidenceScore": 0,
      "rationale": "No GS1 NL attribute for disassembly instructions URL",
      "datasetReferences": [
        "eu.dpp.identification_rules",
        "gs1nl.benelux.diy_garden_pet.v3.1.33",
        "gs1nl.benelux.healthcare.v3.1.33"
      ]
    },
    {
      "mappingId": "MAP-DPP-008",
      "regulationDatapoint": "Battery information",
      "disclosureRequirement": "DPP-Batteries",
      "regulationStandard": "DPP",
      "gs1Attribute": "Battery Type, Battery Capacity",
      "gs1AttributeCode": "BATTERY_TYPE",
      "sectors": [
        "DIY",
        "Healthcare"
      ],
      "confidence": "direct",
      "confidenceScore": null,
      "rationale": "Battery Type and Battery Capacity attributes provide direct coverage for DPP battery requirements",
      "datasetReferences": [
        "eu.dpp.identification_rules",
        "gs1nl.benelux.diy_garden_pet.v3.1.33",
        "gs1nl.benelux.healthcare.v3.1.33"
      ]
    },
    {
      "mappingId": "MAP-E1-001",
      "regulationDatapoint": "Gross Scope 3 GHG emissions",
      "disclosureRequirement": "E1-6",
      "regulationStandard": "ESRS E1",
      "gs1Attribute": null,
      "gs1AttributeCode": null,
      "sectors": [
        "All"
      ],
      "confidence": "missing",
      "confidenceScore": 0,
      "rationale": "No GS1 NL attribute exists for Scope 3 emissions across all three sector models",
      "datasetReferences": [
        "esrs.datapoints.ig3",
        "gs1nl.benelux.diy_garden_pet.v3.1.33",
        "gs1nl.benelux.fmcg.v3.1.33.5",
        "gs1nl.benelux.healthcare.v3.1.33"
      ]
    },
    {
      "mappingId": "MAP-E1-002",
      "regulationDatapoint": "Product carbon footprint",
      "disclosureRequirement": "E1-6",
      "regulationStandard": "ESRS E1",
      "gs1Attribute": null,
      "gs1AttributeCode": null,
      "sectors": [
        "All"
      ],
      "confidence": "missing",
      "confidenceScore": 0,
      "rationale": "No GS1 NL attribute exists for product-level carbon footprint across all three sector models",
      "datasetReferences": [
        "esrs.datapoints.ig3",
        "gs1nl.benelux.diy_garden_pet.v3.1.33",
        "gs1nl.benelux.fmcg.v3.1.33.5",
        "gs1nl.benelux.healthcare.v3.1.33"
      ]
    },
    {
      "mappingId": "MAP-E1-003",
      "regulationDatapoint": "Energy consumption (product)",
      "disclosureRequirement": "E1-5",
      "regulationStandard": "ESRS E1",
      "gs1Attribute": "Energy Efficiency Class",
      "gs1AttributeCode": "ENERGY_EFFICIENCY_CLASS",
      "sectors": [
        "DIY",
        "FMCG"
      ],
      "confidence": "partial",
      "confidenceScore": null,
      "rationale": "Energy Efficiency Class (EU energy label) covers energy consumption but not full lifecycle carbon footprint",
      "datasetReferences": [
        "esrs.datapoints.ig3",
        "gs1nl.benelux.diy_garden_pet.v3.1.33",
        "gs1nl.benelux.fmcg.v3.1.33.5"
      ]
    },
    {
      "mappingId": "MAP-E1-004",
      "regulationDatapoint": "Renewable energy use",
      "disclosureRequirement": "E1-5",
      "regulationStandard": "ESRS E1",
      "gs1Attribute": null,
      "gs1AttributeCode": null,
      "sectors": [
        "All"
      ],
      "confidence": "missing",
      "confidenceScore": 0,
      "rationale": "No GS1 NL attribute exists for renewable energy use in production",
      "datasetReferences": [
        "esrs.datapoints.ig3",
        "gs1nl.benelux.diy_garden_pet.v3.1.33",
        "gs1nl.benelux.fmcg.v3.1.33.5",
        "gs1nl.benelux.healthcare.v3.1.33"
      ]
    },
    {
      "mappingId": "MAP-E1-005",
      "regulationDatapoint": "Climate-related physical risks",
      "disclosureRequirement": "E1-1",
      "regulationStandard": "ESRS E1",
      "gs1Attribute": null,
      "gs1AttributeCode": null,
      "sectors": [
        "All"
      ],
      "confidence": "missing",
      "confidenceScore": 0,
      "rationale": "Corporate-level disclosure, not product-level. No product attribute required.",
      "datasetReferences": [
        "esrs.datapoints.ig3"
      ]
    },
    {
      "mappingId": "MAP-E2-001",
      "regulationDatapoint": "Substances of concern",
      "disclosureRequirement": "E2-4",
      "regulationStandard": "ESRS E2",
      "gs1Attribute": "Hazardous Material Indicator",
      "gs1AttributeCode": "HAZARDOUS_MATERIAL_INDICATOR",
      "sectors": [
        "DIY",
        "Healthcare"
      ],
      "confidence": "partial",
      "confidenceScore": null,